{
  "schema_version": "0.4",
  "postex_version": "0.4.0a1",
  "project_id": "trusted-bio-a1",
  "source_id": "PX-7B014048",
  "input": {
    "path": "AURORA-12-synthetic-manuscript.pdf",
    "sha256": "ddd3aad8b3ed4ba3a82beabf6172b6830d22b2ced40345cfd4cf743ca400e2a5"
  },
  "template": {
    "family": "bioinformatics-pipeline",
    "size": "a1-landscape",
    "width_in": 33.11,
    "height_in": 23.386,
    "asset_sha256": "fc76461cfda7d639e39268165766ed10145c927239327f40e00dfc9d3f0a9d57"
  },
  "palette": {
    "palette_id": "default-academic-safe",
    "source": "PostEx default biomedical design system; original project colors"
  },
  "assets": [
    {
      "id": "aurora-12-fixture",
      "kind": "source-manuscript",
      "license_ref": "CC0-1.0"
    },
    {
      "id": "figure-1-synthetic-pipeline",
      "kind": "scientific_figure",
      "path": "assets/figures/figure-1-synthetic-pipeline.svg",
      "sha256": "f1b93c292584826892f225d2333a3e4ba407d7b956f7a0e0946662f0f97effc2",
      "license_ref": "source-manuscript",
      "pixel_locked": true
    },
    {
      "id": "figure-2-performance",
      "kind": "scientific_figure",
      "path": "assets/figures/figure-2-performance.svg",
      "sha256": "f4d63fabade7dccadbcac1770f3353a7393c511f507d7f88281769bc9fef8bb8",
      "license_ref": "source-manuscript",
      "pixel_locked": true
    },
    {
      "id": "figure-3-calibration",
      "kind": "scientific_figure",
      "path": "assets/figures/figure-3-calibration.svg",
      "sha256": "211a65fb8b0067ecb38a931e3d50db8a3f5e267df4ee1ed2e1a57d50eb6e0070",
      "license_ref": "source-manuscript",
      "pixel_locked": true
    },
    {
      "id": "figure-4-stress-test",
      "kind": "scientific_figure",
      "path": "assets/figures/figure-4-stress-test.svg",
      "sha256": "fca2d76252753b94112ea1f9c88d99c6b488f5f33ccab7dd5977166eaab430f9",
      "license_ref": "source-manuscript",
      "pixel_locked": true
    }
  ],
  "approvals": [
    {
      "subject": "hero_result",
      "proposal_id": "aurora-hero-v1",
      "digest": "sha256:608415cb928b623aae323ee86f83f8fc055e668ee7dd3e82359983b3cb444540",
      "decision": "approved",
      "actor": "user",
      "decided_at": "2026-08-08T03:48:20-04:00"
    },
    {
      "subject": "content_deletion",
      "proposal_id": "aurora-poster-content-v1",
      "digest": "sha256:b3bcfd87b6cd4cd79a8feca304aa0ef7040590c30a9ab8a7e1c04c935414a02b",
      "decision": "approved",
      "actor": "user",
      "decided_at": "2026-08-08T03:48:20-04:00"
    },
    {
      "subject": "palette_application",
      "proposal_id": "default-academic-safe",
      "digest": "sha256:1415dde4c40a1a1652421d6bc9752898c97e4d046e43bf53cdaf31b3423f096d",
      "decision": "approved",
      "actor": "user",
      "decided_at": "2026-08-08T03:48:20-04:00"
    },
    {
      "subject": "palette_application",
      "proposal_id": "gate-image-balanced-fusion",
      "digest": "sha256:f3960633b4ea4f9a139d021c7437f8fa2b8a078f64b1b4c07d950d39e1d4be9d",
      "decision": "approved",
      "actor": "user",
      "decided_at": "2026-08-08T03:48:20-04:00"
    },
    {
      "subject": "palette_application",
      "proposal_id": "paimon-cape-gradient-visual-signature",
      "digest": "sha256:c9834f95586be531d5d8667465b8d0525469d9de17a3f361d76c34ad4677c4ca",
      "decision": "approved",
      "actor": "user",
      "decided_at": "2026-08-08T03:48:20-04:00"
    },
    {
      "subject": "structure_selection",
      "proposal_id": "visual-journey",
      "digest": "sha256:0b56088a8e9db9a0c43b30980553a7303035a06300714e22f7231ace6d15d3ed",
      "decision": "approved",
      "actor": "user",
      "decided_at": "2026-08-08T03:48:20-04:00"
    },
    {
      "subject": "scientific_color_unlock",
      "proposal_id": "paimon-no-green-figures-v1",
      "digest": "sha256:3f39322830d64035ab1c02216a1d307e9a8fed9b535a88e2a92b6fef4fb91f0a",
      "decision": "approved",
      "actor": "user",
      "decided_at": "2026-08-08T03:48:20-04:00"
    },
    {
      "subject": "final_release",
      "proposal_id": "release-trusted-bio-a1-bioinformatics-pipeline-a1-landscape",
      "digest": "sha256:cd7ec3989c21e3e168ff2b2d40f2fe83d278af3ba379d61ff11747f33a82faea",
      "decision": "approved",
      "actor": "PostEx golden-fixture maintainer",
      "decided_at": "2026-08-10T12:00:00-04:00"
    }
  ],
  "provenance": {
    "enabled": true,
    "source_id": "PX-7B014048",
    "mark_text": "Made with PostEx™ · PX-7B014048",
    "object_name": "POSTEX_PROVENANCE_MARK",
    "omission_proposal_id": "omit-px-7b014048",
    "omission_digest": "sha256:5894f8891ea6dca50a93b75e3890ef4e5fa7f61aae217934b0260a0545ec30f7",
    "omission_approved": false
  },
  "preflight": {
    "status": "release-ready",
    "passed": true,
    "release_ready": true,
    "report": "preflight-report.json"
  },
  "outputs": {
    "evidence_report": {
      "path": "evidence-report.json",
      "sha256": "7efed92226736062d619a7fb99c4ca6ef215e296dd18c63772e889f507dab6e6",
      "bytes": 2968
    },
    "extracted_document": {
      "path": "extracted-document.json",
      "sha256": "6bb2ec147eed64e1ead8493b56a27e1e7748823378d1046b4dab90ab6bf92590",
      "bytes": 10219
    },
    "inspect": {
      "path": "trusted-bio-a1-default-academic-safe.inspect.ndjson",
      "sha256": "60259a526a7fb8ebb40c7ddf47f50a98381daf9907e11a96ab68996a7a138400",
      "bytes": 19031
    },
    "layout": {
      "path": "trusted-bio-a1-default-academic-safe.layout.json",
      "sha256": "5a0c1f907bf7d9756cce773d3377cc10fac76d3f6274056b18b88ece522e74ac",
      "bytes": 105071
    },
    "pdf": {
      "path": "trusted-bio-a1-default-academic-safe.pdf",
      "sha256": "1391f93cfc8f3f4c0d017a672738056190db3a1bd57af770a297bda2b5ad2806",
      "bytes": 282360
    },
    "png": {
      "path": "trusted-bio-a1-default-academic-safe.png",
      "sha256": "62aa5106be78edfe8116abc048495619af9c98f4e1c09bba44233bab60259826",
      "bytes": 907924
    },
    "pptx": {
      "path": "trusted-bio-a1-default-academic-safe.pptx",
      "sha256": "4683bbca153cee708d628cc874b22ebb14df8c3375b349afb6044d96554a7887",
      "bytes": 24788
    },
    "preflight_report": {
      "path": "preflight-report.json",
      "sha256": "b15cae538d35f66554a1adf93f5e997deb7454164573b80e703339b3f4e12d39",
      "bytes": 4682
    },
    "render_spec": {
      "path": "render-spec.json",
      "sha256": "541611bcb99eb7fca147ec5a3ae8f7ffa390dede24ab37cdecd8aa348e18b38e",
      "bytes": 6985
    }
  }
}
